S/No,ItemCode,Name,price of 1/2/2021,GMDN 1,GMDN 2,GMDN 3
272.0,MS-C-001711,CRTD ITREVIA 5 HF-T-QP PRO MRI BIOTRONIK # 402657,124839.0,47263,,
1887.0,MS-S-004523,STENT GRAFT VALIANT  THORACIC CAPTIVIA 28X28MM X 100MM MEDTRONIC # VAMF2828C100T,113850.0,48060,,
806.0,MS-K-000153,KNEE PROSTHESIS ROTATIONAL CUSTOM MADE MEDIUM RIGHT LINK # SA-F,112200.0,33692,,
801.0,MS-K-000132,KNEE PROSTHESIS ROTATIONAL WITH PATELLAR FLANGE AND TIBIAL PLATEAU WITH ANTI-LUXATION DEVICE.(CUSTOM,108900.0,33692,,
,16873,ICD SINGLE CHAMBER PRO MRI ELLIPSE VR DEVICE SYS. ABBOTT # CD1377-36QC,99903.38,35852,,
2558.0,MS-S-009225,STENT GRAFT ENDURANT 28 X 13 MM X 166 MM MEDTRONIC # ETBF2813C166EE,83672.0,35281,,
1200.0,MS-P-000947,"PACEMAKER ICD SINGLE CHAMBER W/ARTIRIAL DIAGNOSTICS,BIOTRONIK #368852",82500.0,47267,,
2963.0,MS-T-001635,Thoracic Endoprosthesis Vascular Graft Gore TAG Conformable 45mmx20cm,77592.0,35281,,
2160.0,MS-S-005779,STENT GRAFT ENDURANT 25 MM X 14 MM MEDTRONIC # ETUF2514C102EE,74448.0,35281,,
2993.0,MS-V-000165,VENTILATOR F/HOME PURPOSE ASTRAL 150 # 27063,72600.0,47083,,
530.0,MS-E-000515,ENDO MODULAR REVISION KNEE COMPLETE SYSTEM # 572000905,57750.0,33692,,
269.0,MS-C-001613,CRT-P PRO MRI ETRINSA 8 HF ¿T DEVICE SYSTEM BIOTONIK#405362,49500.0,47263,,
,MS-I-000101,IMPLANT CHONDROTISSUE F/CARTILAGE BIOTISSUE #CT20301,43042.75,33863,,
,MS-S-48981,Total Hip prosthesis implant cast Germany #00135,42735.0,99999,,
,MS-T-000282,TISSUE CHONDRO#CHO-113,39744.0,46426,,
,19031,VALVE MITRAL TISSUE MOSAIC CINCH 31MM MEDTRONIC# 310C31,38424.38,99999,,
301.0,MS-C-002053,CAGE LUMBAR THORACIC IRINE # A23000,34313.0,61230,61958.0,
362.0,MS-C-003646,CATHETER EKOSONIC ENDOVASCULAR DEVICE BRITISH TECHNOLOGY GROUP # 500-55112,33000.0,59223,,
1764.0,MS-S-002328,STENT GRAFT ENDURANT SYSTEM 16/13/95MM MEDTRONIC#ENLW16113C95E,33000.0,35281,,
2239.0,MS-S-007927,STENT ENDURANT EXTENSION ALL SIZES MEDTRONIC #ETLW1613C82EE,33000.0,56284,,
2429.0,MS-S-008762,STENT GRAFT ENDURANT II ILEXT 20MMX82MM MEDTRONIC #ETEW2020C82EE,33000.0,35281,,
2646.0,MS-S-009442,STENT GRAFT SYSTEM ENDURANT II MEDTRONIC # ETLW1613C124EE,33000.0,35281,,
574.0,MS-F-000339,FEMORAL X-SMALL RIGHT COMPONENT. JOH. & JOH. # 1987-14-105,32179.0,44855,,
1515.0,MS-R-000047,ROTATIONAL JOINT UNIT FOR FEMUR & TIBIA.,32175.0,41107,,
817.0,MS-K-000259,KNEE PROSTHESIS BELOW WITH LINER AND PIN SUSPENSION,29403.0,58716,,
560.0,MS-F-000233,FEMORAL STEM BI-METRIC POROUS SIZE 17.0X200MM RIGHT BIOMET #162348,29205.0,44855,,
622.0,MS-G-000388,GRAFT VASCULAR K DV 8MMX100/60CM AXILLO-BIFEMORAL RIGHT. B.BRAUN # 1104705,29123.0,35281,,
803.0,MS-K-000144,KYPHON ADVANCE OSTEO 15/3 INTRODUCER SYSTEM SOFAMORE #KPX153PB-C,28875.0,47129,,
531.0,MS-E-000522,ENDOANCHOR SYSTEM HELI-FX GUIDE F/AORTIC GUIDE 22 MM MEDTRONIC MEDTRONIC # SG-64,28191.0,58096,,
532.0,MS-E-000523,ENDOANCHOR SYSTEM HELI-FX APPLIER CASSETTE 86 CM MEDTRONIC MEDTRONIC # SA-85,28191.0,58097,,
184.0,MS-B-001823,BIPAP BI-LEVEL VENTILATOR WITH EVAPS  FEATURE AND HUMIDIFIER A30 PHILIPS # 1076491,27225.0,36990,,
2046.0,MS-S-004998,STENT VIABAHIN COVERED GRAFT HEP 3.18 10CM F/ VASCULAR GORE MED. ALL SIZES,26903.0,61856,,
2822.0,MS-S-010497,STEM LONG MUTRAS RS HA 14X200MM .IMPLANTCAST # 67622014,24750.0,13180,,
2990.0,MS-V-000124,VALVE TISSUE MITRAL STANDARD SIZE 25MM,24750.0,60241,,
78.0,MS-B-000800,BOLT CONNECTOR TWX SANATMETAL #257920009,24305.0,16077,,
543.0,MS-E-000588,ENDO MODULAR KNEE ROTATIONAL JOINT MED.RIGHT  D=65MM  LINK #15-2817/11,24033.0,33692,,
863.0,MS-M-000627,MODULAR JOINT COMP.SMALL RIGHT D=60MM  LINK #15-2816/11,24033.0,33692,,
181.0,MS-B-001802,"BALLOON EXPANDABLE VIABAHN,DIFFERENT SIZES#GORE MEDICAL USA#BXAXXXX2E GORE # BXAXXXX2E",23513.0,62218,,
2989.0,MS-V-000103,VALVE MITRAL TISSUE MOSAIC CINCH 29MM MEDTRONIC# 310C29,23100.0,60241,,
2830.0,MS-S-010559,STENT GRAFT AORTIC COVERED SIZE 12MM TO 24MM X L120CM VASCULAR  BENTLY #BGP2,22800.0,64344,,
2849.0,MS-S-010603,STEM HA MUTRAS RS 16X200MM FOR CUP.IMPLANTSCAST #67622016,22541.0,13180,,
170.0,MS-B-001776,BONE GRAFT ACH TENDON W/BLOCK 160 FROZEN . LIFENET # FATB,21450.0,16966,,
352.0,MS-C-003541,"CATHETER OUTBACK REENTRY,CORDIS CORDIS # OTB59120A",20625.0,32584,,
2451.0,MS-S-008812,STENT GRAFT COVERA FLAIRED#BARD-USA BARD # AALEOXXXX,20625.0,46689,,
575.0,MS-F-000558,FEMORAL TC3 CEMENTED 2 RIGHT JOH. & JOH. # 960087,20583.0,44855,,
613.0,MS-G-000370,GRAFT TIBIALIS TENDON POSTERIOR  8.5 MM X 24 CM MTF # 400340,20378.0,44874,,
367.0,MS-C-003686,CAGE EXPONDABLE CENTER PIECE 19X23MM 19B. MEDTRONIC # 9391923,20196.0,61230,61958.0,
1486.0,MS-P-004545,PIECECENTER 13X22MMX13C SOFAMOR DANEK. MEDTRONIC # 9391322,19965.0,57806,,
1505.0,MS-P-004659,PROXIMAL MUTRAS CMONENT 127/42MM PART FOR STEM.IMPLANTSCAST #67101627S,19889.0,12696,,
1512.0,MS-P-004680,PROXIMAL COMPONENET MUTARS  RS 135/32MM. IMPLANTCAST #67101535S,19889.0,63995,,
2200.0,MS-S-005840,STENT VENOUS UNCOVERED LARGE DIAMETER VENOVO DIFF. SIZES BARD #VENEL,19800.0,62528,,
595.0,MS-F-000714,"FEMORAL TC3 CEMENTED SIZE 3 LEFT . JOH,JOH #96-0081",18150.0,44855,,
795.0,MS-K-000026,KNEE TOTAL REPLACEMENT GEMINI DIFF.SIZES LEFT.,18150.0,33665,,
796.0,MS-K-000027,KNEE TOTAL REPLACEMENT GEMINI DIFF.SIZES RIGHT,18150.0,33665,,
2956.0,MS-T-001513,TRAY SLEEVE POROUS  45MM M.B.T REVISION METAPHYSEAL. JOH. & JOH. # 1294-50-110,17325.0,58148,,
818.0,MS-K-000260,KNEE PROSTHESIS BELO KNEE EXO SKELETAL,16707.0,64712,,
587.0,MS-F-000644,FEMORAL SLEEVE UNIVERSAL 40MM FULL POROUS. JOH. & JOH. # 1294-53-236,16500.0,44855,,
644.0,MS-H-000046,HIP TOTAL REPLACEMENT CEMENTLESS DIFFERENT SIZES,16500.0,61940,,
1208.0,MS-P-001439,PACEMAKER DUAL CHAMBER W/LEAD & FLEXTEND INGENIO MRI BOSTON #J176DR,16500.0,47265,,
1391.0,MS-P-003711,PLATE TROCHANTER 200MM. IMPLANTCAST # 84000200,16500.0,61573,,
2501.0,MS-S-009037,STENT ABRE #AB9G14060090#MEDTRONIC ALL SIZES MEDTRONIC # AB9G14060090,16500.0,43691,,
1344.0,MS-P-002675,PLATE LOCKING 2.4X5X11 RECONSTRUCTION MANDIBLE OSTEONIC,16434.0,61573,,
408.0,MS-C-003947,COMPONENT FOR PROXIMAL FEMUR RS MUTRAS METEAPHSEAL HA 40MM. IMPLANTCAST # 67304221,15911.0,63995,,
861.0,MS-M-000622,METAPHYSEAL MUTARS COMPONENT 40MM PART FOR STEM.IMPLANTSCAST #67304121,15911.0,61154,,
2926.0,MS-T-000971,TIBIAL INSERT XSMALL 21MM UNIVERSAL HINGE JOH. & JOH. # 1987-27-121,15675.0,46585,,
1188.0,MS-P-000822,PROBE FLOW SZ. 3MM FOR MEDISTIM MACHINE-VQ1111 MEDISTIM#PQ03215645,14850.0,61089,,
2496.0,MS-S-009018,STEM STD 16 REVISION CORAIL. JOH. & JOH. # L98016,14850.0,33581,,
2499.0,MS-S-009027,STEM REVISION COLLARED SIZE 12 STANDARD. JOH. & JOH. # L98012,14850.0,33710,,
2818.0,MS-S-010490,"STEM FEMORAL CEMENTLESS COATED HIP SYSTEM CORAIL REVISION SIZE 13 STANDARD. JOH,JOH # L98013",14850.0,34203,,
2927.0,MS-T-000972,TIBIAL TRAY SIZE 2 CEMENTED ROTATING. JOH. & JOH. # 1294-35-120,14850.0,58716,,
420.0,MS-D-000087,DEVICE ASD OCCLUDER FIGULLA FLEX SIZE 24,14520.0,10760,,
,17021,MESH PHYSIO 15X20CM ETHICON# PHY1520R / COVIDIEN# SYM2015,14345.1,61423,,
822.0,MS-L-000078,LEAD EPICARDIAL BIPOLAR CASPSURE EPI,14108.0,64561,,
258.0,MS-C-001362,CENTERPIECE 16X23MM T2 ALTITUDE SOFAMOR # 9391623,13976.0,34170,,
627.0,MS-G-000687,GRAFT POSTERIOR TIBIALIS TENDON MIN. LENGTH DIAMETER 7.5 MM 230. LIFENET # FPOST.TIBIAL,13750.0,60501,,
,39953,HEART VALVE AORTIC SIZE 25MM SORIN #R5-025/ART25LFA,13343.25,60240,,
2238.0,MS-S-007912,STENT GRAFT VASCULAR EPTFE 9FR 8X80MM BARD#FVL08080 BARD # FVL08080,13200.0,35281,,
2373.0,MS-S-008641,"STENT VASCUFLEX MULTI-LOC-MULTIPLE STENT DELIVER SYSTEM FOR PERIPHERAL SPOT STENTING,SHORT SELF-EXPA",13167.0,57959,,
2206.0,MS-S-005849,STEM FEMORAL SIZE 12.5MM X 150MM BOWED. JOH. & JOH. # 1987-16-211,13022.0,33175,,
1840.0,MS-S-003822,STENT BIOSS LIM BIFURCATION  DRUG ELUTING ALL SIZES,12953.0,56284,,
88.0,MS-B-000958,"BALLOON EXPANDABLE COVERED STENT ATRIUM AVANTA V12 7FR, 7X59MM MAQUET #85335",12694.0,62965,,
2827.0,MS-S-010550,STEM PROXIMAL CEMENTLESS PROSTHESIS RECONSTRUCTION  D 14MMX D12MM L210.LINK #172-921/14,12664.0,33701,,
1600.0,MS-R-000712,REMORAL COMPONENT SIZE 6 LEFT. SMITH&NEPHEW # 71420106,12375.0,61573,,
2089.0,MS-S-005319,STENT  CAROTID X. ACT FREESTYLE 40X8-6MM TAPERED ABBOTT# XRX04008T,12375.0,45851,,
2478.0,MS-S-008957,STEM STD 11 REVISION CORAIL. JOH. & JOH. # L98011,12375.0,33581,,
,MS-V-000113,VALVE MITRAL ATS STANDARD 29MM MEDTRONIC #500DM29,12116.54,60244,,
571.0,MS-F-000316,FILTER NEUROPROTECTION SYSTEM ROBIN OTW / RX TYPE BALTON # SDN,11715.0,44865,,
,MS-S-002238,STENT CORONARY DRUG ELUTED 3.00X38MMMEDTRONIC#RSINT30038X,11643.75,56285,,
,MS-S-002915,STENT CORONARY DRUG ELUTED 3.5X34MM MEDTRONIC #RSINT35034,11643.75,56285,,
,MS-S-003415,STENT CORONARY DRUG SIROLIMUS ELUTING ORSIRO 2.5X13 BIOTRONIK#364476,11643.75,58760,,
,MS-S-005130,STENT CORONARY DRUG SIROLIMUS ELUTING ORSIRO,11643.75,58771,,
,MS-N-000547,NAILANATOMICALFEMORAL10x400MMTITANIUMMICROMED#3.5105.400,11629.09,56643,,
,MS-G-000359,"GLUE ONYX KIT18 PACKAGED, AVM TUMOR F/ EMBOLIZATION MEDTRONIC No.EV-105-7000-060",11612.7,MS-G-000359,,
716.0,MS-H-000584,HUMERUS FRACT STEM COMPR 12MM PPS BIOMET # 12-113562,11554.0,48090,,
2705.0,MS-S-009628,STEM HUMERAL FRACTURE COMPREHENSIVE SHOULDER SYSTEM 10MMX122MM LONG. BIOMET # 12-113560,11554.0,48090,,
2772.0,MS-S-009777,STEM HUMERAL FRACTURE W/MACRO BOND SIZE 10MM. ZIMMER # 11-113560,11554.0,48090,,
415.0,MS-C-003965,"CUP ACETABULAR RECONSTRUCTION CEMENTED PROTRUSIO CAGE 58MM OD 53MM ID RIGHT. JOH,JOH # 1011-73-000",11550.0,56642,,
570.0,MS-F-000313,FILTER WIRE EMBOSHIELD  NAV6 EPS LG ABBOTT #22443-19,11550.0,44841,,
,MS-C-003834,CUFF DVT CALF MEDIUM DR.LIFE # DS022,11385.0,44784,,
640.0,MS-G-000753,GRAFT VASCULAR 8MM/60CM FUSION BIOLINE STRAIGHT EXTERNALLY SUPPORTED . MAQUET # M00201503068B0,11220.0,35281,,
199.0,MS-B-001927,BONE GRAFT CREST WEDGE (ACF)9MM THICKNESS #MTF ;400401,11138.0,58890,,
1559.0,MS-R-000393,ROD POSTERIOR 6.0X80MM SOFAMOR DANEK #79810080,11138.0,64253,,
1580.0,MS-R-000474,ROD POSTERIOR 90MM SOFAMOR DANEK # 79810090,11138.0,64253,,
1590.0,MS-R-000539,ROD 60MM POSTERIOR TRANSITION SOFAMOR DANEK # 79810060,11138.0,64253,,
1757.0,MS-S-002061,STENT SELF EXPANDABLE STENTYS B.BRAUN DES ALL SIZES,11138.0,48160,,
760.0,MS-I-000248,INSERT MODULAR 46MM DUAL MOBILITY STRYKER # 626-00-46F,11031.0,43167,,
,MS-M-000196,MACHINE OXYGEN CONCENTRATOR EVERFLO PHILIPS #1020008-UK,10994.78,31321,,
,MS-S-008885,SEALER OPEN CURVED LARGE JAW MEDTRONIC # LF4418,10994.78,61478,,
,MS-P-001109,PLATE DISTAL TIBIAL 2.7/3.5 L 10HOLE SYNTHES #239.912,10979.28,61573,,
,MS-P-001578,PLATE LCP DISTAL TIBIAL 2.7/3.5 L 10HOLE SYNTHES #239.913,10979.28,61573,,
2611.0,MS-S-009379,"STENT TIGRIS,DIFFERENT SIZES#GORE MEDICAL USA#PHBXXXX2 GORE # PHBXXXX2",10973.0,46689,,
2193.0,MS-S-005828,STEM 15MMX140MM STRAIGHT DISTAL TAPERED J&J # 1976-15-140,10808.0,34190,,
2194.0,MS-S-005829,STEM 14MMX140MM STRAIGHT DISTAL TAPERED J&J # 1976-14-140,10808.0,34190,,
1398.0,MS-P-003736,PLATE LOCKING 4.5X247L X8 HOLE PROXI-FEMPLR  . SYNTHES # 242.808,10770.0,61573,,
,17791,STENT CORONARY DRUG ELUTED 2.5 X12MM  # ENSP25012X MEDTRONIC,10758.83,56285,,
,MS-S-000012,STENT TAXUS DRUG ELUTING (ALL SIZES),10730.88,56304,,
23.0,MS-B-000302,BIPOLAR HEMI ARTHROPLASTY DIFFERENT SIZES,10725.0,33695,,
77.0,MS-B-000780,BALLOON DRUG ELUTING PTA PASEO-18 LUX BIOTRONIC ALL SIZES,10725.0,62218,,
584.0,MS-F-000591,FEMORAL PS CEMENTED SIZE 4 RIGHT. JOH. & JOH. # 1504-10-204,10725.0,44855,,
585.0,MS-F-000614,FEMORAL POSTERIOR STABILIZED SIZE 7 RIGHT CEMENTED ATTUNE. JOH. & JOH. # 1504-10-207,10725.0,44855,,
611.0,MS-G-000360,GRAFT VASCULAR 7MM X 80CM FUSION BIOLINE STRAIGHT DOUBLE LAYERS MAQUET#M00201503087B0,10725.0,35281,,
2645.0,MS-S-009440,"STENT PERIPHERAL SYSTEM PRIME XIENCE BTK EVEROLIMUS ELUTING,FREESIZES MEDISERV # 1012646-38",10725.0,47932,,
592.0,MS-F-000684,FIBULA SHAFT BONE GRAFT 10MM L12-13MM W.FREEZE DRIED.  MTF  # 400751,10534.0,47938,58890.0,
,MS-M-000100,MESH PHYSIO 15X20CM ETHICON# PHY1520R /COVIDIEN# SYM2015,10432.8,61423,,
,18206,STENT CORONARY DRUG SIROLIMUS ELUTING ORSIRO 2.75X35 BIOTRONIK #391236,10328.47,58760,,
,20086,STENT DRUG ELUTING 2.75 X 26 MM,10316.52,56285,,
1216.0,MS-P-001676,PLATE MATRIX MESH NEURO 1008100 SYNTHES #04.503.084,10217.0,46642,,
259.0,MS-C-001410,CAGE 5.5MM INTRABODY OSSEOFIX ALPHATEC SPINE #21298-45,10044.0,61230,61958.0,
122.0,MS-B-001210,BALLOON DRUG COATED LUTONIX CORONARY DCB DIFF. SIZES BARD #9020,9975.0,17521,,
631.0,MS-G-000701,GRAFT VASCULAR FUSION PTFE RINGED 8MM X 80MM MAQUET # 503088,9950.0,35281,,
572.0,MS-F-000334,FEMORAL POSTERIOR STABILIZED CEMENTED SIZE 5 LEFT SIGMA J&J # 1960-40-500,9938.0,44855,,
578.0,MS-F-000561,FEMORAL POSTERIOR SIZE 4 LEFT STABILIZED CEMENTED SMITH&NEPHEW # 1960-50-400,9938.0,61271,,
581.0,MS-F-000571,FEMORAL COMPONENT SIZE 5 RIGHT IMPLANT POSTERIOR.STAB. SMITH&NEPHEW # 171421115,9938.0,35668,,
591.0,MS-F-000667,FEMORAL POSTERIOR STABILIZED CEMENTED SIZE 5 RIGHT. JOH. & JOH. # 1960-50-500,9938.0,44855,,
1149.0,MS-N-001578,NON-LUGED NON-POROUS FEM LT SZ 2.5 SIGMA PS JOH. & JOH. # JOLOP196040250,9938.0,32841,,
853.0,MS-M-000324,MESH PLATE 100X100MM 0.4MM MALLEABLE MATRIXNEURO SYNTHES# 04.503.083,9916.0,46580,,
79.0,MS-B-000806,BONE GRAFT GENEX 10CC OSTEOCONDUCTION+OSTEOINDUCTION BIOCOMPOSITES #900-010,9900.0,43999,,
645.0,MS-H-000047,HIP TOTAL REPLACEMENT CEMENTED DIFFERENT SIZES,9900.0,61940,,
1337.0,MS-P-002656,PROSTHESIS PENILE MALLEABLE DIFF. SIZE COLOPLAST # 519250 /519260 /519270,9900.0,36251,,
1507.0,MS-P-004667,PENILE PROSTHSIS TACTRA  DIFFERENTS SIZE. BOSTON SCIENTIFIC CORPORATION #720080XX,9900.0,36251,,
1525.0,MS-R-000166,RING ANNULOPLASTY 33MM DURAN ANCORE CHORDIAL GUIDE 620R,9900.0,45577,,
2161.0,MS-S-005782,STEM SIZE 4 ACCOLADE II 132 DEG. STRYKER # 6720-0435,9900.0,13180,,
2201.0,MS-S-005841,STENT SELF EXPANDABLE F/ SFA FULL POPLITIAL LIFESTENT DIFF. SIZES BARD #EV1C,9900.0,57959,,
2807.0,MS-S-010397,STEM FEMORAL HIP SYSTEM COATED CORIAL REVISION 12/14 AMT 135 STANDARD COLLAR SIZE 14.JOH. & JOH. #L9,9900.0,34203,,
,39707,PLATE DISTAL FIBULA 6 HOLES CHM # 3.7029.606,9862.256,61573,,
118.0,MS-B-001198,BOLT LOCKING 20MMX95MMX95MM CEMENTLESS J&J # 1975-20-095,9818.0,16077,,
302.0,MS-C-002088,CUP COMBI F/HIP SIZE 44 LINK # 182-001/44,9818.0,35661,,
387.0,MS-C-003810,CUP COMBI PF LARGE 54MM. LINK # 182-001/54,9818.0,56642,,
782.0,MS-I-000630,INSERT CUP COMBI PF SMALL 46MM. LINK # 182-001/46,9818.0,48090,,
,MS-R-000306,RING MITRAL ANNULOPLASTY SIZE 30MM CARBOMEDICS/MEDTRONIC No.AR-730/638RL30,9660.0,99999,,
117.0,MS-B-001191,BONEGRAFT WEDGE FLIXER OSTEOTECH 15 X 15 X40MM # 60000215INT,9636.0,16966,,
304.0,MS-C-002093,CUP COMBI F/HIP SIZE 54 LINK # 182-001/54,9625.0,35661,,
539.0,MS-E-000574,EXTENTION PIECE RS 25MM FOR BONE.,9625.0,42308,,
567.0,MS-F-000291,FIXATOR EXTERNAL DISTAL RADIUS #MO-110D,9625.0,64739,,
1270.0,MS-P-002513,"PATCH DURA SUBSTITUTE 3X3"" DUREPAIR MEDTRONIC # 61105",9625.0,32327,,
2205.0,MS-S-005848,STEM 115MM X 12MM UNIVERSAL. JOH. & JOH. # 86-7426,9625.0,13180,,
126.0,MS-B-001220,BONE GRAFT 10CC PUTTY LIFENET # TPUT10,9603.0,46543,,
1166.0,MS-O-000204,OPTIUM DBM PUTY 10CC LIFENET HEALTH AMICO MEDICAL INSTRUMENT CO. # TPUT10,9603.0,47257,,
1555.0,MS-R-000379,"ROD CROSSLINK, CERVICAL.MEDIUM SOFAMOR DANEK #7752536",9570.0,64253,,
800.0,MS-K-000129,KIT STIMULAN 10CC W. PAST BIOCOMPOSITES # 600-010,9529.0,47967,,
159.0,MS-B-001745,BONE GRAFT PUTTY 10CC . LIFENET # T43110INT,9455.0,61884,,
1556.0,MS-R-000382,RING MITRAL MEMO 3D SIZE 28MM SORIN #ICV 0968,9433.0,45577,,
1557.0,MS-R-000383,RING MITRAL MEMO 3D SIZE 30MM SORIN #ICV 0969,9433.0,45577,,
1558.0,MS-R-000384,RING MITRAL MEMO 3D SIZE 32MM SORIN #ICV 0970,9433.0,45577,,
1219.0,MS-P-001786,PLATE HUMERAL PHILOS LONG PROXIMAL DIAPHYEAL 3.5MM 10HOLES SYNTHES #241.923,9407.0,46647,,
,MS-B-000506,BLOODLINE 5008 SYSTEM FRESENIUS#F00000384,9389.52,33309,,
2167.0,MS-S-005799,STENT BIOMIME DES LONG LENGTH  MORPH DRUG ELUTIN ALL SIZES MERIL LIFE # BIO22513,9256.0,56284,,
281.0,MS-C-001823,COR-KNOT MINIMAL INVASIVE KIT W/ 5MM APPLICATOR AND 12 QUICK LOAD PETER SURGICAL#030925,9249.0,45213,,
608.0,MS-G-000330,GRAFT FLIXENE GRADUATED WALL TAPER 4-7MM X 35CM PTFE ATRIUM # 25129,9240.0,35281,,
,MS-B-000669,BALLOON DRUG ELUTING IN-PACT FALCON ALL SIZES INVATEC # 072-FL-2002B12,9222.885,47732,,
2992.0,MS-V-000149,VALVE PROGRAMMABLE BURR HOLE CODMAN #82-3184,9210.0,44856,,
69.0,MS-B-000546,BASIC VPAP AUTO 25 EASY BREATHE MACHINE W/ FULL MASK RESMED #26101,9117.0,60711,,
180.0,MS-B-001799,BONE GRAFT PINNACLES GRITION REVISION AUGMENT 20MM 54MM/56MM. JOH. & JOH. # 1217-20-354,9075.0,61780,,
810.0,MS-K-000220,KNEE BRACE UNLOADER ONE W/ SMART DOSING RIGHT MEDIAL OSSUR#B-240518713/712,9075.0,41065,,
2942.0,MS-T-001417,TIBIAL FB CEMENTED BASE SIZE 5 . JOH. & JOH. # 1506-00-005,9075.0,58716,,
2950.0,MS-T-001467,TIBIAL BASE PLATE FIXED BEARING SIZE 7 CEMENTED ATTUNE. JOH. & JOH. # 1506-00-007,9075.0,58716,,
54.0,MS-B-000482,BALLOON CATHETER RELIANT MEDTRONIC#AB46,9048.0,17184,,
165.0,MS-B-001760,BONE ACCELL CONNEXUS 10CC Sea spine # 20-3000-100,8952.0,43999,,
565.0,MS-F-000281,FIBER REUSABLE SLIMLINE 365 MICRON LUMENIS #0642-148-60,8910.0,62184,,
566.0,MS-F-000282,FIBER REUSABLE SLIMLINE 550 MICRON LUMENIS #0624-149-60,8910.0,63527,,
,18386,STENT CORONARY DRUG SIROLIMUS ELUTING ORSIRO 2.25X26 BIOTRONIK # 264489,8893.962,99999,,
614.0,MS-G-000374,GRAFT VASCULAR 8 MM X 60 CM FUSION STRAIGHT LOT. MAQUET # M002015010680,8869.0,35281,,
610.0,MS-G-000357,GELPOINT PATH TRANSANAL ACCESS PLATFORM APPLIED MED# CN011,8848.0,63391,,
2854.0,MS-S-010689,STEM MODULAR CEMENTLESS 280MM. LINK #15-2952/09,8807.0,34203,,
2858.0,MS-S-010741,STEM MODULAR 240MM CEMENTLESS  LINK #15-2952/08,8807.0,13180,,
370.0,MS-C-003714,CUP PF 52MM MEDIUM. LINK # 182-001/52,8663.0,56642,,
554.0,MS-F-000187,FEMORAL POSTERIOR STABILIZED CEMENTED 2.5 RIGHT SIGMA DEPUY J&J #1960-50-250,8663.0,44855,,
555.0,MS-F-000188,FEMORAL POSTERIOR STABILIZED CEMENTED 2.5 LEFT SIGMA DEPUY J&J #1960-40-250,8663.0,44855,,
557.0,MS-F-000216,FEMORAL POSTERIOR STABILIZED CEMENTED SIZE 3 LEFT J & J #1960-40-300,8663.0,34203,,
569.0,MS-F-000307,FEMORAL PS CEMENTED SIZE 4 LEFT J&J # 196040400,8663.0,38156,,
573.0,MS-F-000335,FEMORAL POSTERIOR SIZE 2 LEFT STABILIZED CEMENTED J&J # 1960-40-200,8663.0,61271,,
583.0,MS-F-000579,FEMORAL CEMENTED POSTERIOR STABILIZED 2 R. JOH. & JOH. # 1960-50-200,8663.0,61940,,
588.0,MS-F-000655,FEMORAL POSTERIOR STABILIZED CEMENTED SIZE 1.5 L. JOH. & JOH. # 1960-40-150,8663.0,44855,,
742.0,MS-I-000035,IMPLANT FEMORAL POSTERIOR STABILIZED CEMENTED SIZE 3 RIGHT DEPUY SYNTHES SIGMA J&J# 1960-50-300,8663.0,52747,,
1253.0,MS-P-002290,PROBE BALL TIP 175MM SOFAMOR DANEK # PSP2001,8663.0,61325,,
2370.0,MS-S-008633,"STENT EXPANDABLE SMARTFLEX OPEN ALL SIZES,SF0610MV#CORDIS CORDIS # SF06120MV",8663.0,63844,,
183.0,MS-B-001819,BONE GRAFT ILIAC CREST (TRICORTICAL) 25MM WEDGE HEIGHT-PRESERVON. LIFENET # PICW2.5,8634.0,16966,,
,17786,STENT CORONARY DRUG ELUTED 3.5 X 22 MM #  MEDTRONIC /RSINT35022X,8607.06,56285,,
,17796,STENT CORONARY DRUG ELUTED 2.25X20MM TAXUS#(H749389402022,8607.06,56285,,
307.0,MS-C-002107,CEMENTLESS PROSTHESIS SYSTEM SIZE 3 LENGTH 210 . LINK # 172-921/18,8580.0,58951,,
1272.0,MS-P-002519,PROBE SURGEON CONTROLLED MEDTRONIC # SPK1004 MEDTRONIC # SPK1004,8580.0,35723,,
636.0,MS-G-000737,GRAFT VASCULAR FILIXIENE GRADUATED WALL PTFF WITH DOUBLE SILDER GDS 4-7MMX45CM. MAQUET # 25138,8567.0,35281,,
1629.0,MS-R-000745,RADIAL STEM MODULAR WITH SCREW EXPLOR 9X30MM. BIOMET # 11-210064,8544.0,33701,,
2799.0,MS-S-010342,STEM RADIAL WITH SCREW MODULAR SIZE 6MMX24MM LENGTH. ZIMMER # 11-210061,8544.0,45039,,
2817.0,MS-S-010456,STEM RADIAL MODULAR WITH SCREW 8MMX28MM LENGTH.ZIMMER BIOMET # 11-210063,8544.0,33701,,
2860.0,MS-S-010750,STEM RADIAL MODULAR EXPLOR WITH SCREW 7MMX26MM LENGTH ZIMMER BIOMET #11-210062,8544.0,33701,,
,SME1403,CPAP MASK ADULT SIZE # TAIWAN,8534.61,37591,,
909.0,MS-N-001015,NECK SEGMENT WITHOUT COLLAR CEMENTLESS 12/14MM X 65MM / 126 LINK # 172-964/26,8448.0,61467,,
1504.0,MS-P-004658,PLATE LCP DISTAL HUMERAL LE  8HOLES L194 SST .SYNTHES #02.104.028,8393.0,46647,,
273.0,MS-C-001715,CATHETER VENTRICULAR MICROSENSOR KIT CODMAN #826633,8363.0,64442,,
,MS-B-000507,BI-BAG 5008S 900GM FRESENIUS#5060801,8286.831,35849,,
,MS-P-003887,PLATECLAVICAL8HOLESCHM3.7048.508,8259.3,35670,,
556.0,MS-F-000197,FEMORAL COMPONENT MED.SMALL PLUS LB2 GEMINI #318-103/26,8250.0,44855,,
580.0,MS-F-000570,FEMORAL COMPONENT  SIZE 5 LEFT POSTERIOR STABILIZEE SMITH&NEPHEW # 171421015,8250.0,44855,,
2199.0,MS-S-005839,STENT VALEO VASCULAR EXPANDABLE BALLOON UNCOVERED BARD #EV2C,8250.0,43691,,
2987.0,MS-V-000064,VALVE AORTIC SIZE 18MM PEDIATRIC CARBOMEDICS#A5-018,8250.0,60350,,
652.0,MS-H-000111,HUMERAL STEM 11MM X 150MM S/STEEL TIPMED  #019039,8182.0,60512,,
654.0,MS-H-000115,HUMERAL STEM 7MM X 130MM S/STEEL TIPMED #018964,8182.0,34197,,
561.0,MS-F-000236,FILTER VENA CAVA REMOVABLE OPTION ELITE FEMORAL ARGON #171-352506070E,8085.0,44864,,
161.0,MS-B-001755,"BONE BLOCK TRICORTICAL MEDIUM (L 20X30MM) ,(W 15X18MM),(T1 , 7MM,(T2 , 4M. MEDTRONIC # T00210INT",8036.0,16966,,
,MS-C-0086354,CPAP PRO W/HEATED HUMIDIFIER & MASK GEL AMARA,8000.0,64592,,
2991.0,MS-V-000148,VALVE PROGRAMMABLE IN LINE CODMAN #82-3164,7985.0,35965,,
260.0,MS-C-001453,CANCELLOUS BLOCK 20X20X30MM # T00170INT,7951.0,17751,,
,MS-P-004620,"PLATE PROXIMAL TIBIAL 3 HOLE , CHM #3.4009.603",7928.928,61573,,
110.0,MS-B-001107,BALLOON RANGER PTA CATHETER 0.018 PACLITAXEL- COATED ALL SIZES BOSTON SCIENTIFIC #H749392198,7920.0,47732,,
630.0,MS-G-000700,"GRAFT SILVER 14 X 7MM,40CM . B.BRAUN # 1108017",7901.0,16266,,
70.0,MS-B-000578,BALLOON SEQUENT PLEASE DRUG ELUTING ALL SIZES,7893.0,58760,,
1690.0,MS-S-000629,STENT EPIC SELF EXPANDABLE NITINOL ALL SIZES,7797.0,43691,,
1691.0,MS-S-000630,STENT EXPRESS VASCULAR ALL SIZES.,7797.0,44279,,
2054.0,MS-S-005065,STEM HIP UNCEMENTED STANDARD SIZE 03 H-144 LINK #164-005,7797.0,33581,,
,50639,TUBING CUSTOM PACK SET MEDTRONIC #M960446C,7741.138,35441,,
541.0,MS-E-000578,EXTENTION PIECE RS 25MM PART FOR STEM.IMPLANTSCAST #67300025,7735.0,61562,,
13.0,MS-A-000503,"AMPLATZER VASCULAR PLUGSIZE 12,FREESIZES MEDISERV # 9-PLUG-012",7700.0,46852,,
314.0,MS-C-003392,CATHETER GUIDING GUIDE LINER SPECIAL MEDICAL TECH. # 5571,7700.0,17846,,
414.0,MS-C-003964,"CUP POLYETHLENE CEMENTED XL. JOH,JOH # 9655-13-245",7700.0,56642,,
851.0,MS-M-000304,MINILINK TRANSMITTER F/ INSULIN PUMP PARADIGM VEO SYSTEM MEDTRONIC #MMT-7725WW,7700.0,60770,,
2207.0,MS-S-005850,SEGMENTAL 125MM COMPONENT. JOH. & JOH. # 1987-07-125,7700.0,58885,,
2928.0,MS-T-000973,TIBIAL COMPONENT SIZE 3 MEDIUM RIGHT CEMENTED LINK # 318-482/03,7700.0,58716,,
,MS-S-000543,STENT DRUG ELUTING SIZE 3.0x26MM.,7675.933,35882,,
75.0,MS-B-000770,BALLOON DRUG ELUTING PACIFIC IN-PACT INVATEC#MB-PAD,7604.0,58760,,
722.0,MS-H-000602,HEAD RADIAL 24MM POLY ASSEMBLY. INTEGRA LIFE SCIENCES # 22-1424,7604.0,33701,,
2770.0,MS-S-009749,STEM RADIAL ASSEMBLY 7.5MMX20MM LENGTH INTEGRA LIFE SCIENCES # 22-1675,7604.0,41488,,
1027.0,MS-N-001444,NAIL FOOT HIND 11.5MMX20CM LEFT. SMITH&NEPHEW # SN-71701120L,7585.0,44854,,
119.0,MS-B-001199,BONE GRAFT WEDGE 15MM ILIAC CREST . LIFENET # PICW5,7557.0,16966,,
1345.0,MS-P-003269,POSTERIOR AUGMENT COMBO CEMENTED SZ2 4MM JOH. & JOH. # 960826,7548.0,35217,,
5.0,MS-A-000158,ACETABULAR CLUSTER 54MM STRYKER # 542-11-54F,7527.0,48055,,
120.0,MS-B-001208,BONE GRAFT CANCELLOUS WEDGE 11-16MM LENGTH 7MM HEIGHT LIFENET # PTCWP7,7527.0,46543,,
20.0,MS-A-000524,AUTOCPAP/APAP DEVICE AIRSENSE 10  F/ OBSTRUCTIVE SLEEP APNEA INCLUDING STD. ACCESSORIES RESMED #3726,7524.0,60711,,
,MS-S-003465,STENT D/ELUTED PROMUS ELEMENT 2.75x20M,7510.995,56285,,
2900.0,MS-T-000876,THROMBECTOMY DEVICE ROTATIONAL SYSTEM 6FRx65CM.9MM CLEANER XT AMCO# 171-700009XT,7508.0,58172,58173.0,58174.0
2901.0,MS-T-000877,THROMBECTOMY DEVICE ROTATIONAL SYSTEM 6FRx135CM.9MM CLEANER XT AMCO# 171-700109XT,7508.0,58172,,
1004.0,MS-N-001407,NAIL HIND FOOT 11.5MMX20CM LEFT . SMITH&NEPHEW # 71701120L,7491.0,44854,,
576.0,MS-F-000559,FEMORAL  ADAPTER 5 DEGREE JOH. & JOH. # 960781,7479.0,59688,,
723.0,MS-H-000604,HEAD MODULAR VERSA-DIAL 46X27X46MM. ZIMMER # 113048,7418.0,39702,,
736.0,MS-H-000638,HEAD MODULAR W/VARIABLE OFFSET VERSA-DIAL SHOULDER STSYTEM.BIOMET #113046,7418.0,48088,,
2997.0,MS-V-000313,VERSAL-DIAL 50X24X52 HUM HEAD 52MMX24X50 BIOMET # 113055,7418.0,58784,,
2853.0,MS-S-010688,STEM MODULAR CEMENTLESS 160MM LINK #15-2952/06,7389.0,34203,,
211.0,MS-C-000643,CUP ACETABULAR METAL CASING SIZE:44MM LINK# 290-300/44,7373.0,56642,,
568.0,MS-F-000305,FEMORAL COMPONENT RIGHT  SIGMA SZ 1.5 R  J&J # 196050150,7348.0,44855,,
187.0,MS-B-001832,BALLOON LUMINOR 14 PACLITAXEL ELUTING PTA DILATATION CATHETER ALL SIZES#SAUDI SICLI COMP#BPDPC14M SA,7315.0,62218,,
378.0,MS-C-003757,CORAIL CEMENTED STANDARD OFFSET SIZE 9 JOH. & JOH. # JOLOPL96409,7315.0,33178,,
558.0,MS-F-000222,FEMORAL STEM CEMENTLES CORAIL2 STAN. SIZE 11  J&J # 3L92511,7315.0,33175,,
679.0,MS-H-000519,HIP SYSTEM CEMENTED FEMORAL STEM SIZE 11 STANDARD NO COLLAR. JOH. & JOH. # L96411,7315.0,61271,,
715.0,MS-H-000582,HIP STEM PROSTHESIS SP-CL SYSTEM SIZE 8 LEFT. LINK # 177-227/26,7315.0,33581,,
726.0,MS-H-000612,HIP PROSTHESIS STEM SP-CL LEFT SIZE 9.SIZE LINK # 177-228/26,7315.0,33581,,
862.0,MS-M-000623,MESH VENTRAL HERNIA REPAIR SYMOTEX OPEN SKIRT 30CMX20CM. COVIDIEN #SYM3020OS,7315.0,61765,,
1165.0,MS-O-000203,OFFSET CEMENTED STANDARD CORAIL SIZE 8 JOH. & JOH. # JOLOPL96408,7315.0,61271,,
1836.0,MS-S-003758,STEM FEMORAL CORAIL 2 STAND CMENTLES SIZE 12 J&J# 3L92512,7315.0,58481,,
1893.0,MS-S-004575,STEM  FEMORAL CEMENTLES SIZE 8 J&J #3L92507,7315.0,33175,,
2157.0,MS-S-005760,STEM SP-CL RIGHT SIZE 6 LINK # 177-205/26,7315.0,13180,,
2158.0,MS-S-005770,STEM SP-CL LEFT SIZE 10 LINK # 177-229/26,7315.0,33581,,
2159.0,MS-S-005772,STEM SP-CL LEFT SIZE 12 LINK # 177-231/26,7315.0,13180,,
2234.0,MS-S-007896,STEM OFFSET STANDARD SIZE11 (COLLARLESS). JOH. & JOH. # 3L92511,7315.0,13180,,
2405.0,MS-S-008687,STEM FEMORAL CEMENTLESS COATED 12/14 SIZE 10. JOH. & JOH. # 3L92510,7315.0,34191,,
